{
  "candidate_id": "c03",
  "status": "fixed",
  "reason": "Test passes after the fix.",
  "test": {
    "file": "tests/antibody/test_twin_c03_webhooks.py",
    "node_id": "test_event_age_with_offset_timestamp"
  },
  "red": {
    "exit_code": 1,
    "passed": false,
    "duration_s": 1.7,
    "output_tail": "E   TypeError: can't subtract offset-naive and offset-aware datetimes\n1 failed in 1.33s",
    "recorded_at": "2026-09-26T10:18:41+00:00",
    "recorded_by": "antibody-cli"
  },
  "green": {
    "exit_code": 0,
    "passed": true,
    "duration_s": 1.5,
    "output_tail": "1 passed in 0.98s",
    "recorded_at": "2026-09-26T10:20:19+00:00",
    "recorded_by": "antibody-cli"
  },
  "fix_summary": "Compute event age with an aware now()."
}
