{
  "candidate_id": "c01",
  "status": "fixed",
  "reason": "Test passes after the fix.",
  "test": {"file": "tests/antibody/test_twin_c01_subscriptions.py", "node_id": "test_renewal_check_accepts_aware_datetimes"},
  "red": {"exit_code": 1, "passed": false, "duration_s": 1.84, "output_tail": "E   TypeError: can't compare offset-naive and offset-aware datetimes\n1 failed in 1.21s", "recorded_at": "2026-09-26T10:18:12+00:00", "recorded_by": "antibody-cli"},
  "green": {"exit_code": 0, "passed": true, "duration_s": 1.62, "output_tail": "1 passed in 1.02s", "recorded_at": "2026-09-26T10:20:06+00:00", "recorded_by": "antibody-cli"},
  "fix_summary": "Use datetime.now(timezone.utc) in the renewal check."
}
